{
  "meta": {
    "slug": "sulmira",
    "titulo": "La voz que le prestaron",
    "subtitulo": "Sulmira Martínez Pérez, \"Salem Cuba\", 21-22 años, condenada a 5 años de prisión por memes y llamados pacíficos a protestar en Facebook: la autoinculpación forzada que la televisión estatal transmitió como si fuera su propia voz.",
    "descripcion": "Sulmira Martínez Pérez, conocida en redes como \"Salem Cuba\" o \"Salem Cuba Censura\", tenía entre 21 y 22 años cuando fue detenida en La Habana. Usaba su cuenta de Facebook para publicar memes, mensajes críticos del gobierno cubano, llamados pacíficos a protestar y opiniones disidentes; ninguno de los cargos formales que enfrenta incluye un solo acto de violencia.\n\nLa Seguridad del Estado la detuvo el 10 de enero de 2023. Fue recluida inicialmente en Villa Marista, la sede de la policía política cubana en La Habana, donde, según fuentes corroboradas, fue obligada a una autoinculpación forzada que después se transmitió por la televisión estatal: un guion ajeno, leído bajo coacción, presentado al país como si fuera su propia voz.\n\nSe le acusa de delitos contra el orden constitucional, en la modalidad de propaganda contra el orden, y de desacato. El juicio se pospuso varias veces antes de celebrarse finalmente en noviembre de 2024; la Fiscalía pidió en ese momento una condena de diez años de prisión. En julio de 2025, antes de que se dictara sentencia, fue trasladada desde su centro de reclusión anterior a un campamento penitenciario, donde permanece hoy. La condena llegó después, en febrero de 2026: cinco años de privación de libertad, la mitad de lo que había solicitado la Fiscalía.\n\nNorma Pérez Ferrer, madre de Sulmira, ha denunciado públicamente que el régimen no ha entregado a la familia una copia de la sentencia. Prisoners Defenders documenta en su ficha oficial que Sulmira presenta problemas de salud, entre ellos neumonía. Cuatro organizaciones de derechos humanos (Prisoners Defenders, Cubalex, Alas Tensas e ICLEP) la reconocen como presa política.\n\nDos afirmaciones del envío original no pudieron confirmarse con más de una fuente y quedan marcadas de forma visible como no confirmadas, nunca como hechos asentados: que las condiciones de reclusión en el campamento penitenciario sean \"precarias\" o \"terribles\", y que a Sulmira le correspondería la libertad condicional y esta le haya sido negada de forma arbitraria. Ambas afirmaciones provienen del mismo origen (un testimonio de su madre recogido por un solo medio, CiberCuba) y no han sido corroboradas de forma independiente.\n\nEl caso de Sulmira no es aislado. Cristian Labrada fue condenado a diez años de prisión por una sola publicación en Facebook; Yasser García López, a cinco años por publicaciones similares; dos personas más recibieron condenas de cinco y cuatro años por publicar en la misma red; un joven fue condenado a siete años por criticar al gobierno en redes sociales. Prisoners Defenders contaba, en su informe de abril de 2026, ciento cuarenta y dos mujeres entre mil doscientos sesenta presos políticos en Cuba; su informe de junio de 2026 eleva el total a mil doscientos ochenta y uno, con lo que la organización describe como una nueva ofensiva contra las mujeres, sin que exista todavía un desglose actualizado de cuántas de ellas son mujeres a esa fecha.\n\nEste expediente separa siempre el caso de Sulmira del patrón más amplio de condenas por publicaciones en redes sociales: ninguna cifra de un nivel se usa para completar lo que falta en el otro.",
    "narracion": "Sulmira Martínez Pérez, conocida como Salem Cuba, tenía entre veintiuno y veintidós años cuando la Seguridad del Estado la detuvo en La Habana, el diez de enero de dos mil veintitrés. Usaba Facebook para publicar memes y mensajes críticos del gobierno, y para llamar de forma pacífica a protestar. Ningún cargo en su contra incluye un acto de violencia. Fue recluida en Villa Marista, sede de la policía política, donde la obligaron a una autoinculpación forzada que la televisión estatal transmitió como si fuera su propia voz. Se le acusa de delitos contra el orden constitucional y de desacato. El juicio se pospuso varias veces y se celebró en noviembre de dos mil veinticuatro; la Fiscalía pidió entonces diez años de prisión. En julio de dos mil veinticinco, antes de la sentencia, la trasladaron a un campamento penitenciario, donde sigue hoy. La condena llegó en febrero de dos mil veintiséis: cinco años de privación de libertad. Su madre denuncia que no se ha entregado copia de la sentencia a la familia. Prisoners Defenders documenta que ha tenido neumonía; junto a Cubalex, Alas Tensas e ICLEP, la reconoce como presa política. Otros cinco cubanos fueron condenados a entre cuatro y diez años por publicar en redes sociales. Dos afirmaciones sobre sus condiciones de reclusión, de una sola fuente, quedan marcadas como no confirmadas.",
    "version": "1.0.0",
    "fecha_datos": "2026-07-27",
    "advertencia": "Las condiciones de reclusión en el campamento penitenciario y una posible negativa de libertad condicional se apoyan en un testimonio único de la madre de Sulmira, recogido por un solo medio (CiberCuba); aparecen marcadas visiblemente como no confirmadas, nunca como hechos asentados."
  },
  "intro": {
    "parrafos": [
      "Sulmira Martínez Pérez, conocida en redes como \"Salem Cuba\" o \"Salem Cuba Censura\", tenía entre 21 y 22 años cuando la Seguridad del Estado la detuvo en La Habana el 10 de enero de 2023. Usaba Facebook para publicar memes, mensajes críticos del gobierno y llamados pacíficos a protestar; ninguno de sus cargos incluye violencia.",
      "En Villa Marista fue obligada a una autoinculpación forzada que la televisión estatal transmitió como si fuera su propia voz. El juicio se pospuso varias veces, se celebró en noviembre de 2024 y terminó, en febrero de 2026, en una condena de cinco años de prisión, la mitad de lo que había pedido la Fiscalía.",
      "Su caso se suma a otros: personas condenadas a entre cuatro y diez años de prisión por publicar en Facebook. Este expediente mantiene el caso de Sulmira y ese patrón más amplio en secciones separadas, cada una con su propia fuente y su propio grado de verificación."
    ]
  },
  "caso_indice": {
    "advertencia": "Los hechos centrales de este caso (identidad, fecha de detención, cargos, autoinculpación forzada, aplazamientos, juicio, traslado y condena) están corroborados por la ficha oficial de Prisoners Defenders y por prensa independiente. Las condiciones de reclusión descritas como \"precarias\" y la presunta negativa arbitraria de libertad condicional provienen de una sola fuente y quedan marcadas como no confirmadas.",
    "perfil": {
      "nombre": "Sulmira Martínez Pérez",
      "alias": "\"Salem Cuba\" / \"Salem Cuba Censura\"",
      "edad_detencion": "21-22 años (las fuentes varían) al momento de la detención",
      "lugar": "La Habana"
    },
    "hechos": [
      {
        "afirmacion": "Usaba su cuenta de Facebook para publicar memes, mensajes críticos del gobierno cubano, llamados pacíficos a protestar y opiniones disidentes; ninguno de los cargos formales en su contra incluye un acto de violencia.",
        "confianza": "corroborada",
        "fuente": "Prisoners Defenders (ficha oficial), CiberCuba, Diario de Cuba"
      },
      {
        "afirmacion": "Fue detenida el 10 de enero de 2023 por la Seguridad del Estado.",
        "confianza": "corroborada",
        "fuente": "Prisoners Defenders (ficha oficial)"
      },
      {
        "afirmacion": "Se le acusa de delitos contra el orden constitucional, en la modalidad de propaganda contra el orden.",
        "confianza": "corroborada",
        "fuente": "Prisoners Defenders, Diario de Cuba"
      },
      {
        "afirmacion": "Se le acusa también de desacato.",
        "confianza": "corroborada",
        "fuente": "Prisoners Defenders, Diario de Cuba"
      },
      {
        "afirmacion": "Fue recluida inicialmente en Villa Marista, sede de la Seguridad del Estado en La Habana.",
        "confianza": "corroborada",
        "fuente": "CiberCuba, Revista El Estornudo"
      },
      {
        "afirmacion": "Fue obligada a una autoinculpación forzada que se transmitió por la televisión estatal.",
        "confianza": "corroborada",
        "fuente": "CiberCuba, Diario de Cuba, ADN Cuba"
      },
      {
        "afirmacion": "El juicio se pospuso varias veces antes de celebrarse.",
        "confianza": "corroborada",
        "fuente": "CiberCuba, Diario de Cuba"
      },
      {
        "afirmacion": "El juicio se celebró finalmente en noviembre de 2024; la Fiscalía pidió en ese momento una condena de diez años de prisión.",
        "confianza": "corroborada",
        "fuente": "Diario de Cuba, ADN Cuba"
      },
      {
        "afirmacion": "Fue condenada en febrero de 2026 a cinco años de privación de libertad.",
        "confianza": "corroborada",
        "fuente": "Prisoners Defenders (ficha oficial), CiberCuba"
      },
      {
        "afirmacion": "Su madre, Norma Pérez Ferrer, denunció que el régimen no ha entregado copia de la sentencia a la familia.",
        "confianza": "corroborada",
        "fuente": "CiberCuba"
      },
      {
        "afirmacion": "Fue trasladada en julio de 2025, antes de conocerse la condena, desde su centro de reclusión anterior a un campamento penitenciario, donde se encuentra hoy.",
        "confianza": "corroborada",
        "fuente": "Prisoners Defenders (ficha oficial), CiberCuba"
      },
      {
        "afirmacion": "Presenta problemas de salud reportados, entre ellos neumonía, según la ficha oficial de Prisoners Defenders.",
        "confianza": "corroborada",
        "fuente": "Prisoners Defenders (ficha oficial)"
      },
      {
        "afirmacion": "Es reconocida como presa política por Prisoners Defenders, Cubalex, Alas Tensas e ICLEP.",
        "confianza": "corroborada",